entity,entity_group,headline,outlet,cluster_name,dominant_frame,stance_bucket,mention_weight,evidence_excerpt,link
UN,Actor / organisation,"‘Issues’ over international protection Bill, says Connolly on first visit overseas",The Irish Times,Ukraine war and moral neutrality,Ukraine / Russia / Moral Responsibility,Mixed / procedural / unclear,0.939,"‘Issues’ over international protection Bill, says Connolly on first visit overseas | President strongly defends UN and warns democracy is under threat while attending Barcelona gathering of left-leaning leaders | The piece discusses neutrality as a central theme in Ireland's diplomacy, highlighted during President Connolly's Barcelona trip. | neutrality, democracy, Ireland, UN, defence | There are “issues in relation” to the Government’s international protection Bill, President Catherine Connolly has said during her first overseas visit, describing the legislation as “very, very significant”. Connolly is attending the Defence of Democracy event, a gathering of left-leaning political leaders in Barcelona, organised by Spanish prime minister Pedro Sánchez and Brazilian president Luiz Inácio Lula da Silv",https://irishtimes.com/politics/2026/04/18/issues-over-international-protection-bill-says-connolly-on-first-visit-overseas
UN,Actor / organisation,"UK defence of Ireland of less concern to public than thought, conference told",The Irish Times,Ukraine war and moral neutrality,Peacekeeping / Identity / Tradition,Lean preserve neutrality,0.939,"Irish public is “pretty prudent” and “quite pragmatic” on defence and security if international challenges are explained, the British-Irish Parliamentary Assembly (Bipa) has been told. Speaking to the body in Tralee, Co Kerry on Tuesday, Prof Andrew Cottey of University College Cork said issues such as the fact the Royal Air Force is responsible for Irish air security are less bothersome to public opinion than many think. “There is a pragmatic centre ground on many of these issues,” Cottey, the holder of the Jean Monnet Chair in European Political Integration, told the inter-parliamentary body. “Defence and security co-operation makes sense for both Ireland and the United Kingdom. Both have different national security policies – Ireland’s military neutrality and the UK’s membership of Nato are both long-standing policies,” he said. READ MORE Fintan O’Toole: Once one of the most influential people in Irish media, he ignored his own golden rule “Ea",https://irishtimes.com/ireland/2026/03/24/uk-defence-of-ireland-of-less-concern-to-public-than-thought-conference-told
Midlands Today,Media outlet,Midlands Today - Neutrality,Midlands Today,Sinn Féin and government neutrality clash,Other Neutrality Debate,Preserve / strengthen neutrality,0.688,"Midlands Today - Neutrality | mary lou macdonald claims the government is trying to dismantle irish neutrality by stealth. | Mary Lou MacDonald's claim that the government is dismantling Irish neutrality frames neutrality as a central political issue. | neutrality, Irish neutrality, Mary Lou MacDonald, politics, government | mary lou macdonald claims the government is trying to dismantle irish neutrality by stealth. addressing a rally in dublin, deputy macdonald renewed her message to fianna fail and fine gael that if it wants to scrap the triple lock, they need to put it to the people.",
Midlands Today,Media outlet,Midlands Today - Neutrality,Midlands Today,Sinn Féin and government neutrality clash,Other Neutrality Debate,Preserve / strengthen neutrality,0.688,"Midlands Today - Neutrality | mary lee macdonald claims the government parties are trying to dismantle irish neutrality by stealth. | The segment centers on neutrality in Ireland, illustrating claims that Irish neutrality is being dismantled by stealth. | Irish neutrality, Irish politics, government, stealth, dismantling neutrality | mary lee macdonald claims the government parties are trying to dismantle irish neutrality by stealth. addressing a rally in dublin yesterday, the sinn fein leader said fianna fail and fine gael want to scrap the triple lock without consent and without a mandate. deputy macdonald says the country can't allow itself to be dragged into someone else's war.",
Midlands Today,Media outlet,Midlands Today - Neutrality,Midlands Today,Sinn Féin and government neutrality clash,Other Neutrality Debate,Preserve / strengthen neutrality,0.688,"Midlands Today - Neutrality | the sinn fein leader says any move to change ireland's neutrality must be put to the people in a referendum. | Mary Lou McDonald's remarks on neutrality frame the issue as requiring a referendum on any change, tying neutrality to defence and national policy. | neutrality, referendum, defence, Ireland, politics | the sinn fein leader says any move to change ireland's neutrality must be put to the people in a referendum. speaking at an easter commemoration ceremony in kildare, mary lou macdonald accused the thaetic of overseeing what she calls a systematic dismantling of our neutrality in its efforts to remove the triple lock she claims the government is shifting ",
Midlands Today,Media outlet,Midlands Today - Neutrality,Midlands Today,Sinn Féin and government neutrality clash,Other Neutrality Debate,Mixed / procedural / unclear,0.688,"Midlands Today - Neutrality | taoiseach of overseeing a systematic dismantling of irish neutrality speaking at an easter commemoration ceremony in kildare the sinn f president warned ireland is | The segment discusses Ireland's neutrality and accuses the government of dismantling neutrality and moving closer to NATO. | neutrality, NATO, EU, Ireland, neutral status | mary lou macdonald is accusing the taoiseach of overseeing a systematic dismantling of irish neutrality speaking at an easter commemoration ceremony in kildare the sinn f president warned ireland is being drawn closer to eu and nato military structures she says if the government believes there is public support for abandoning ire",
Midlands Today,Media outlet,Midlands Today - Neutrality,Midlands Today,Sinn Féin and government neutrality clash,Other Neutrality Debate,Preserve / strengthen neutrality,0.688,"Midlands Today - Neutrality | be neutral, well you have to protect your neutrality we can protect your neutrality at the moment, it looks like for our six months | Discussion of neutrality and Ireland's stance on protecting neutrality during the EU presidency and potential security commitments. | neutrality, defence, ireland, peacekeeping, diplomacy | tral if you're going to be neutral, well you have to protect your neutrality we can protect your neutrality at the moment, it looks like for our six months of the european presidency we're going to have to bring in forces from other countries to try and make sure that basically foreign foreign countries who shall be a say are not in favour of u",
Waterford News & Star,Media outlet,"Irish neutrality should be put to a public vote, say Sinn Féin - Homepage - Waterford News & Star",Waterford News & Star,Referendum and constitutional protection,Other Neutrality Debate,Preserve / strengthen neutrality,0.785,"Irish neutrality should be put to a public vote, say Sinn Féin - Homepage - Waterford News & Star | Mary Lou McDonald said Sinn Fein want to see a ‘positive assertion’ on Irish neutrality in the constitution. | The article covers Sinn Féin's push to enshrine neutrality in the Irish constitution and to hold a public referendum. | neutrality, referendum, Ireland, defence, EU | Irish neutrality should be put to a public vote, say Sinn Féin By Bairbre Holmes, Press Association The Government should put Irish neutrality to a public vote, Sinn Féin have said. The party launched their policy, Protecting Ireland’s Neutrality, in Dublin on Thursday. Speaking to reporters at the event, Sinn Féin leade",https://waterford-news.ie/irish-neutrality-should-be-put-to-a-public-vote-say-sinn-f%C3%A9in_arid-93952.html
Waterford News & Star,Media outlet,Neutrality motion causes war in Waterford Council chamber - News - Waterford News & Star,Waterford News & Star,Triple Lock and UN mandate debate,Triple Lock / UN Mandate,Preserve / strengthen neutrality,0.785,"Neutrality motion causes war in Waterford Council chamber - News - Waterford News & Star | Mayor of Waterford City and County Council Seamus Ryan slammed on the gavel and called for orders as Sinn Féin and Fianna Fáil councillors sparred ... | The article reports on Waterford City and County Council's motion about Ireland's neutrality and the Triple Lock, highlighting how neutrality relates to defence policy. | neutrality, Triple Lock, defence policy, Ireland, UN Security Council | Waterford City and County Council passed a motion 16-12 condemning the Irish Government’s moves to disband the ‘Triple Lock’- the mechanism Ireland uses to send its defence forces abroad. The motion brought forwar",https://waterford-news.ie/news/neutrality-motion-causes-war-in-waterford-council-chamber_arid-84206.html
Waterford News & Star,Media outlet,"Sinn Féin MEPs have 'abandoned Ukraine', Minister says - Homepage - Waterford News & Star",Waterford News & Star,Sinn Féin and government neutrality clash — Ukraine/political angle,Ukraine / Russia / Moral Responsibility,Mixed / procedural / unclear,0.747,"Sinn Féin MEPs have 'abandoned Ukraine', Minister says - Homepage - Waterford News & Star | The loan involved €30 billion of financial support and €60 billion for military equipment | The article centers on Ireland's neutrality amid Sinn Féin's opposition to a Ukraine loan and ties the debate to defence and political issues. | neutrality, Ireland, Ukraine, Sinn Féin, European Parliament | James Cox Minister of State Neale Richmond has accused Sinn Féin of ""abandoning Ukraine"" after its MEPs voted against a €90 billion loan to the country amid the ongoing Russian war. The loan involved €30 billion of financial support and €60 billion for military equipment. Sinn Féin MEPs Kathleen Funchion an",https://waterford-news.ie/sinn-f%C3%A9in-meps-have-abandoned-ukraine-minister-says_arid-87719.html
Waterford News & Star,Media outlet,"Martin faces complex Trump meeting, Sinn Féin criticised over White House claim - Homepage - Waterford News & Star",Waterford News & Star,Defence capability and security gaps,Ukraine / Russia / Moral Responsibility,Mixed / procedural / unclear,0.747,"Martin faces complex Trump meeting, Sinn Féin criticised over White House claim - Homepage - Waterford News & Star | Here, we have a look at the issues likely to dominate political discourse in the week to come | The article centers on neutrality as a theme in Ireland's defence and foreign-policy debates, including Ireland's stance on the Ukraine loan and US relations. | neutrality, defence, Ireland, Ukraine, foreign-policy | James Cox Here, we have a look at the issues likely to dominate political discourse in the week to come. St Patrick's Day looms large for Taoiseach March 17th is still a while away but Taoiseach Micheál Martin will undoubtedly be strategising about his visit to the Whit",https://www.waterford-news.ie/martin-faces-complex-trump-meeting-sinn-f%C3%A9in-criticised-over-white-house-claim_arid-88676.html
Waterford News & Star,Media outlet,Humanitarian surgeon announced as Waterford Grand Marshal for St Patrick's Day - News - Waterford News & Star,Waterford News & Star,General neutrality debate #2,Ukraine / Russia / Moral Responsibility,Mixed / procedural / unclear,0.747,"Humanitarian surgeon announced as Waterford Grand Marshal for St Patrick's Day - News - Waterford News & Star | He has since been to Ukraine on two occasions, once to Lebanon and more recently on two missions to Gaza | The article profiles Dr Morgan McMonagle and his humanitarian missions, underscoring neutrality as a key principle in conflict zones and noting praise from Waterford officials. | neutrality, humanitarianism, Gaza, Waterford, conflict zones | Esteemed humanitarian and surgeon, Dr Morgan McMonagle has been announced as Grand Marshall of this year's St Patrick's Day Parade in Waterford City. Originally from Cavan, Dr McMonagle is a vascular surgeon at University Hospital Waterfor",https://www.waterford-news.ie/news/humanitarian-surgeon-announced-as-waterford-grand-marshal-for-st-patricks-day_arid-86703.html
Kilkenny People,Media outlet,"Fuel demonstrations prove protests ‘effective’, say neutrality campaigners",Kilkenny People,Defence capability and security gaps,Other Neutrality Debate,Preserve / strengthen neutrality,0.784,"Fuel demonstrations prove protests ‘effective’, say neutrality campaigners | Last week’s fuel demonstrations have shown the power of protest, the supporters of a march in support of Irish neutrality have said. A national anti-war demonstration is due to take place in Dublin city centre on Saturday. Organisers say they want greater protections for Irish neutrality and t... | The article discusses Irish neutrality amid anti-war protests and defence policy debates, underscoring the relevance of neutrality to current affairs. | neutrality, anti-war, Ireland, defence policy, Triple Lock | Last week’s fuel demonstrations have shown the power of protest, the supporters of a march in support of Iris",http://kilkennypeople.ie/news/national-news/2062602/fuel-demonstrations-prove-protests-effective-say-neutrality-campaigners.html
Kilkenny People,Media outlet,"Irish neutrality should be put to a public vote, say Sinn Fein",Kilkenny People,Referendum and constitutional protection,Other Neutrality Debate,Preserve / strengthen neutrality,0.784,"Irish neutrality should be put to a public vote, say Sinn Fein | The Government should put Irish neutrality to a public vote, Sinn Fein have said. The party launched their policy, Protecting Ireland’s Neutrality, in Dublin on Thursday. Speaking to reporters at the event Sinn Fein leader Mary Lou McDonald said if the Government wanted to “dismantle&rdq... | The article covers Sinn Fein's proposals to enshrine neutrality in Ireland's constitution and reconsider defence commitments, highlighting neutrality as a central political issue. | neutrality, Ireland, Sinn Fein, referendum, defence | The Government should put Irish neutrality to a public vote, Sinn Fein have said. The party launched thei",http://kilkennypeople.ie/news/national-news/2058095/irish-neutrality-should-be-put-to-a-public-vote-say-sinn-fein.html
Kilkenny People,Media outlet,Kilkenny neutrality meeting calls for ‘people power’ to bring peace,Kilkenny People,Defence capability and security gaps,Other Neutrality Debate,Preserve / strengthen neutrality,0.784,"Kilkenny neutrality meeting calls for ‘people power’ to bring peace | New cross-party link-up grouping - “Ar Chlé” (“On the Left”) launched in Kilkenny | The article reports on a Kilkenny meeting debating Ireland's neutrality and calls to defend neutrality, including a proposed referendum on the Triple Lock. | neutrality, referendum, Ireland, NATO, arms-control | Katharine Patricia Stephenson, Kathleen Funchion, Edward Horgan, Seán Ó hArgáin, Tom Healy and Adrienne Wallace A lively meeting on neutrality and the Triple Lock, was recently held at the Club House Hotel, Kilkenny, called by a new cross-party link-up grouping - “Ar Chlé” (“On the Left”). More than 50 people took part. Keynote spea",https://www.kilkennypeople.ie/news/kilkenny-city/2038109/kilkenny-neutrality-meeting-calls-for-people-power-to-bring-peace.html
Kilkenny People,Media outlet,‘Dangerous development’ - Kilkenny MEP warns against EU proposal,Kilkenny People,Ukraine war and moral neutrality,Peacekeeping / Identity / Tradition,Preserve / strengthen neutrality,0.747,"‘Dangerous development’ - Kilkenny MEP warns against EU proposal | The politician from Callan was elected to the EU Parliament in 2024 | The article centers on neutrality in Ireland's foreign policy amid EU veto reforms and reflects support for maintaining Ireland's neutral stance. | neutrality, Ireland, EU veto, foreign policy, militarisation | SIGN IN Use your email address Life is 100% LOCAL with Kilkenny Live EU Parliament Sinn Féin MEP for Ireland South, Kathleen Funchion, has strongly criticised proposals by Ursula von der Leyen to introduce qualified majority voting in EU foreign policy. MEP Funchion said: “President von der Leyen’s proposal to remove the veto on EU foreign policy is ",https://www.kilkennypeople.ie/news/politics/2063053/dangerous-development-kilkenny-mep-warns-against-eu-proposal.html
Kilkenny People,Media outlet,Grassroots anti-war meeting takes place in Kilkenny,Kilkenny People,Shannon Airport and US military use #2,Other Neutrality Debate,Preserve / strengthen neutrality,0.747,"Grassroots anti-war meeting takes place in Kilkenny | A number of delegates were welcomed to weekly vigil for Palestine after the meeting | The article discusses neutrality in the context of Ireland's neutrality and calls to defend it, including references to the Irish Neutrality League at a Kilkenny meeting. | neutrality, Ireland, defence, politics, neutrality policy | Speakers at the meeting in Lyrath House Hotel last week A grassroots meeting with Iranian, Palestinian and Irish speakers was held at Lyrath House Hotel in Kilkenny on Wednesday. The meeting, a fringe event at the annual conference of the Teachers Union of Ireland, was well attended by local people and TUI delegates. Many in ",https://www.kilkennypeople.ie/news/local-news/2060456/grassroots-anti-war-meeting-takes-place-in-kilkenny.html
LMFM,Media outlet,LMFM - Neutrality,LMFM,Ukraine war and moral neutrality,Other Neutrality Debate,Mixed / procedural / unclear,0.857,"LMFM - Neutrality | there has been incredible wholehearted support for neutrality in this country. | Neutrality is presented as a central issue with broad public support in Ireland and ongoing discussion about its political implications. | neutrality, Ireland, UN, defence, politics | yeah, absolutely. and we have had, do you remember these two, where michal martin inserted the triple lock in order to get that treaty over the line? there has been incredible wholehearted support for neutrality in this country. if you look at the polls over the last number of years, neutrality has always wanted to be maintained. if you look at the fact that 18 councils across this island, gerry,",
LMFM,Media outlet,LMFM - Neutrality,LMFM,Ukraine war and moral neutrality,Other Neutrality Debate,Mixed / procedural / unclear,0.78,"LMFM - Neutrality | as always, yeah, we're going to be hearing about concerns being raised over how emotion relating to ireland's military neutrality was handled at a meeting of meath county council. | Discussion of concerns about how Ireland's military neutrality was handled at a Meath County Council meeting. | neutrality, defence, politics, Meath, council | as always, yeah, we're going to be hearing about concerns being raised over how emotion relating to ireland's military neutrality was handled at a meeting of meath county council. i'm going to be speaking to two councillors on either side of that debate. more than 40 adults living in emergency accommodation in county meath are currently",
LMFM,Media outlet,LMFM - Neutrality,LMFM,Ukraine war and moral neutrality,Other Neutrality Debate,Mixed / procedural / unclear,0.78,"LMFM - Neutrality | coming up on this morning's programme, concerns have been raised over how a motion relating to ireland's military neutrality was handled at the meeting of meath county council. | The programme discusses neutrality, focusing on how a Meath County Council motion about Ireland's military neutrality was handled. | neutrality, Meath, council, military neutrality, debate | y. coming up on this morning's programme, concerns have been raised over how a motion relating to ireland's military neutrality was handled at the meeting of meath county council. a&tu councillor eamert-hobin criticised what she describes as a deliberate attempt to shut down democratic debate. we'll talk abou",
LMFM,Media outlet,LMFM - Neutrality,LMFM,Ukraine war and moral neutrality,Other Neutrality Debate,Mixed / procedural / unclear,0.78,"LMFM - Neutrality | now, concerns have been raised over how a motion relating to ireland's military neutrality was handled at a meeting of meath county council. | The discussion centers on Ireland's neutrality and a Meath County Council motion on neutrality, highlighting concerns about democratic debate. | neutrality, defence, council, motion, debate | now, concerns have been raised over how a motion relating to ireland's military neutrality was handled at a meeting of meath county council. aintu councillor eamert tobin criticised what she described as a deliberate attempt",
LMFM,Media outlet,LMFM - Neutrality,LMFM,Ukraine war and moral neutrality,Other Neutrality Debate,Mixed / procedural / unclear,0.78,"LMFM - Neutrality | the party launched a new policy paper today accusing the coalition of attempting to dismantle neutrality piece by piece. | Neutrality is framed as being attacked by political actions, highlighted by Sinn Fein's policy paper about dismantling neutrality. | neutrality, politics, defence, policy, coalition | sinn fein is calling on the government to abandon attempts to end the triple lock on troop deployment. the party launched a new policy paper today accusing the coalition of attempting to dismantle neutrality piece by piece. and the justice minister has reiterated a public inquiry into the kreisla explosion will not occur until after a garda investigation into the inciden",
Shannonwatch,Actor / organisation,Kilkenny neutrality meeting calls for ‘people power’ to bring peace,Kilkenny People,Defence capability and security gaps,Other Neutrality Debate,Preserve / strengthen neutrality,0.784,"as recently held at the Club House Hotel, Kilkenny, called by a new cross-party link-up grouping - “Ar Chlé” (“On the Left”). More than 50 people took part. Keynote speaker was Edward Horgan, former UN Peacekeeper in the Irish Defence Forces, and a founder of Shannonwatch. He set out how the people of Ireland and all humanity are experiencing war impact including environmental destruction, migration crises and genocide in Palestine and Sudan. Read next: Plea for spot checks on vape shops in Kilkenny amid new licensing shake-up Councillor Adrienne Wallace of People Before Profit pointed to NATO complicity in arming the genocide in Gaza and said our Government has only paid lip service to opposing it - only people power can bring peace. Kathleen Funchion, Sinn Fein MEP, called for an Irish Referendum on removing the Triple Lock. Senator Patricia Stephens emphasised that our neutrality has given us significant power – Ireland’s good standing in the ",https://www.kilkennypeople.ie/news/kilkenny-city/2038109/kilkenny-neutrality-meeting-calls-for-people-power-to-bring-peace.html
Shannonwatch,Actor / organisation,91 year old lady walking to Dáíl welcomes Laois supporters,Leinster Express,Shannon Airport and US military use,Shannon / US Military / Anti-war,Preserve / strengthen neutrality,0.744," as far as I know. They can come and tell us that they do, in which case that would be interesting news.,” the activist said. She is also walking in memory of her late friend and comrade Margaretta D’Arcy. Follow the walk on socials @walkwithlelia and see www.shannonwatch.org for updates Contact walkwithlelia@proton.me to get involved and offer support. Subscribe or register today to discover more from DonegalLive.ie Buy the e-paper of the Donegal Democrat, Donegal People's Press, Donegal Post and Inish Times here for instant access to Donegal's premier news titles. Keep up with the latest news from Donegal with our daily newsletter featuring the most i",https://www.leinsterexpress.ie/news/newsletter-laois-live/2053521/91-year-old-lady-walking-to-dail-welcomes-laois-supporters.html
The Kerryman,Media outlet,It’s time for Irish people to push back against war on neutrality,The Kerryman,General neutrality debate #2,Shannon / US Military / Anti-war,Preserve / strengthen neutrality,0.951,"It’s time for Irish people to push back against war on neutrality | | A letter urging Irish citizens to defend neutrality and oppose involvement in foreign wars. | neutrality, war, Irish neutrality, Shannon Airport, Garden of Remembrance | Sir, Thousands have died because Trump and Israel have launched illegal and devastating wars. Watching the death and destruction has become unbearable for many of us – and that’s just ![img-0.jpeg](img-0.jpeg) Images taken from on board the Artemis II space craft. on TV. All this is made worse for the vast majority of Irish people who favour Irish neutrality because Ireland is implicated in these terrible wars through the use of Shannon Airport by the US m",
The Kerryman,Media outlet,It’s time for Irish people to push back against war on neutrality,The Kerryman,General neutrality debate #2,Shannon / US Military / Anti-war,Preserve / strengthen neutrality,0.951,"It’s time for Irish people to push back against war on neutrality | | A Kerryman letter by Joe Harrington urging Ireland to defend neutrality and organize a demonstration to oppose war and UK/US militarism, referencing the Artemis II context. | Irish neutrality, Shannon Airport, Garden of Remembrance, Triple Lock, demonstration | Sir, Thousands have died because Trump and Israel have launched illegal and devastating wars. Watching the death and destruction has become unbearable for many of us – and that’s just ![img-0.jpeg](img-0.jpeg) Images taken from on board the Artemis II space craft. on TV. All this is made worse for the vast majority of Irish people who favour Irish neutrality because",
