entity,entity_group,headline,outlet,cluster_name,dominant_frame,stance_bucket,mention_weight,evidence_excerpt,link
The Irish Times,Media outlet,Kathy Sheridan: Our neutrality won’t shield us from skyrocketing fuel prices,The Irish Times,Ukraine war and moral neutrality,Ukraine / Russia / Moral Responsibility,Move away / stronger alignment,1.074,"Kathy Sheridan: Our neutrality won’t shield us from skyrocketing fuel prices | As Irish generosity to Ukrainians wanes, remember that rising costs are another result of war | The article argues that Ireland's neutrality in the Ukraine crisis is nuanced and should be understood beyond simplistic labels. | neutrality, Ireland, Ukraine, diplomacy, public opinion | Last November in Dublin, the second in command of Volodymyr Zelenskiy’s office, Sergiy Kyslytsya, got an unexpected insight into delicate Irish sensitivities. During a closed-door discussion with TDs, the Ukrainian suggested that geographical remoteness no longer protected countries such as Ireland and Portugal – upon which the Fianna",https://irishtimes.com/opinion/2026/05/06/kathy-sheridan-irish-neutrality-fuel-prices-ukraine-war-refugees
The Irish Times,Media outlet,"Crime fiction: Anne Cadwallader blends politics, violence, law and media in gripping debut",The Irish Times,Ukraine war and moral neutrality,Ukraine / Russia / Moral Responsibility,Mixed / procedural / unclear,1.033,"Crime fiction: Anne Cadwallader blends politics, violence, law and media in gripping debut | Plus new works by Rosemary Hennigan; Catriona Ward; Claire Coughlan; and James Wolff | A literary review that centers on neutrality as a theme in justice and political intrigue across several novels, illustrating its relevance to defence and politics. | neutrality, justice, Northern Ireland, novels, politics | The author of Holy Cross: The Untold Story (2004) and Lethal Allies: British Collusion in Ireland (2013), former journalist Anne Cadwallader’s debut novel Crossing Over (Mercier Press, £15.99) opens with English lawyer Eleanor “Lena” Dawson relocating from London to Belfast in 1987 in a bid to ",https://irishtimes.com/culture/books/review/2026/04/20/crime-fiction-anne-cadwallader-blends-politics-violence-law-and-media-in-gripping-debut
The Irish Times,Media outlet,"Letters to the Editor, March 30th: On redress schemes in health service, consultants’ fees and let’s hear it for the buses",The Irish Times,Ukraine war and moral neutrality,Ukraine / Russia / Moral Responsibility,Reform / redefine neutrality,1.033,"Letters to the Editor, March 30th: On redress schemes in health service, consultants’ fees and let’s hear it for the buses | It does nothinig to address the root causes of recurring scandals | The piece engages with neutrality in Ireland's defence policy, highlighting governance shortcomings and urging accountability in the context of military neutrality. | neutrality, defence, national security, governance, Ireland | Sir, – The news that Minister for Mental Health Mary Butler has announced a compensation scheme for injury inflicted on hundreds of children by North Kerry Child and Adolescent Mental Health Services (Camhs) is yet another example of the State salving its conscience with a cheq",https://irishtimes.com/opinion/letters/2026/03/30/letters-to-the-editor-march-30th-on-redress-schemes-in-health-service-consultants-fees-and-lets-hear-it-for-the-buses
The Irish Times,Media outlet,Irish Defence Forces must continue to hold the blue line in Lebanon,The Irish Times,Ukraine war and moral neutrality,Peacekeeping / Identity / Tradition,Preserve / strengthen neutrality,1.033,"Irish Defence Forces must continue to hold the blue line in Lebanon | In a wider geopolitical context of escalating conflict, and growing militarisation, someone must stand up for peace | The article argues that neutrality remains essential to Ireland's Unifil peacekeeping role and urges Ireland to uphold neutrality. | neutrality, peacekeeping, Unifil, Ireland, UN | With two Indonesian peacekeepers killed this week as Israel continues its military assault on Lebanon, the situation facing Irish peacekeepers serving with the United Nations peacekeeping mission, Unifil, is increasingly perilous. There has been what Taoiseach Micheál Martin described as a “shocking escalation of violence that ha",https://irishtimes.com/opinion/2026/04/02/irish-defence-forces-must-continue-to-hold-the-blue-line-in-lebanon
The Irish Times,Media outlet,Sinéad O'Sullivan: Calling in the Defence Forces against fuel protesters is a huge strategic error,The Irish Times,Ukraine war and moral neutrality,Defence Capability / Underinvestment,Preserve / strengthen neutrality,1.033,"Sinéad O'Sullivan: Calling in the Defence Forces against fuel protesters is a huge strategic error | By sending in the army to move tractors, the Government has proved every sceptic of increased defence spending right | The article discusses neutrality in Ireland's defence policy amid protests and argues for stronger defence capability, illustrating how neutrality is being reconsidered in this context. | defence, neutrality, Ireland, military, protests | The French have been blocking streets to force the hand of the state since 1789. In 2018, they blocked roundabouts in yellow vests and the government reversed a fuel tax within weeks. In France, barricades are not a threat to the republic – ",https://irishtimes.com/opinion/2026/04/09/sinead-osullivan-calling-in-the-defence-forces-against-fuel-protesters-is-a-huge-strategic-error
Government,Actor / organisation,Kathy Sheridan: Our neutrality won’t shield us from skyrocketing fuel prices,The Irish Times,Ukraine war and moral neutrality,Ukraine / Russia / Moral Responsibility,Move away / stronger alignment,1.074,"nomy and that fuel and food prices were going through the roof in the words of Taoiseach Micheál Martin. These have. We’ve just forgotten why. [ Fuel protests were a display of mine-is-bigger-than-yours machismo ] We were shielded from soaring energy costs by Government cash injections while neutrality ideologues talked a heady game about soft power and pounced on bits of Government humanitarian aid that might conceivably assist some military objective. Our default position, then and now, is that instead of donating military aid, Ireland would welcome Ukrainian refugees with generous supports and no cap on numbers. It was always going to be a logistical challenge in a pre-existing housing crisis, but that was presumably our moral deal. In the end, over 112,000 received temporary protection here. That ranks us eighth in the EU when measured per thousand of population, according to February Eurostat figures. Germany, Poland and the Czech Republic c",https://irishtimes.com/opinion/2026/05/06/kathy-sheridan-irish-neutrality-fuel-prices-ukraine-war-refugees
Government,Actor / organisation,Letters to the Editor: Neutralising Ireland’s neutrality,The Irish Examiner,Ukraine war and moral neutrality,Shannon / US Military / Anti-war,Preserve / strengthen neutrality,1.074," that is morally wrong.’ It is therefore difficult to rationalise Taoiseach Micheál Martin’s decision to remove the necessity of a United Nations mandate for the deployment of Irish troops abroad. The mandate is the core of the triple lock, which requires UN, government, and Dáil approval before troops can be sent overseas. The Irish people voted to reject both the Nice (in 2001) and Lisbon treaties (in the first referendum in 2008) because of fears of a militarised EU, but were reassured after Fianna Fáil introduced the lock. Now, there is the possibility that Irish troops could be deployed at the behest of the EU, and the EU is inextricably linked with Nato. To remove the lock would negate Ireland’s credibility as a peacemaker. Ireland needs to work for reform of the UN and be a voice for peace. US president JF Kennedy stated in his speech to the Dáil in 1963 that: “It matters not how small a nation is that seeks world peace.” It does matter th",https://irishexaminer.com/opinion/yourview/arid-41838741.html
Government,Actor / organisation,Classic Hits 4FM - Neutrality,Classic Hits 4FM,Sinn Féin and government neutrality clash,Triple Lock / UN Mandate,Preserve / strengthen neutrality,1.045," growing violence in the middle east that's according to anti-war activists who today protested outside city hall in dublin calling for triple lock legislation to remain unchanged the demonstration took place during a dublin city council debate on whether the government should be stopped from scrapping the un mandate needed to deploy irish troops overseas the government argues this will prevent the five permanent members of the un security council russia, china, the us, the uk and france from using their veto on irish peacekeeping missions. niamh nivreen, member of the neutrality roadshow,",
Government,Actor / organisation,"Sally Rooney and Omar Barghouti speak at BDS Panel: ""The Irish government is not listening to its people, not just about Palestine but about everything"" | Hotpress",Hot Press,Defence capability and security gaps,Shannon / US Military / Anti-war,Preserve / strengthen neutrality,1.033,"Sally Rooney and Omar Barghouti speak at BDS Panel: ""The Irish government is not listening to its people, not just about Palestine but about everything"" | Hotpress | Sally Rooney and Omar Barghouti were joined by a number of other speakers, addressing sports boycotts, academic boycotts and the Occupied Territories Bill. | A Dublin panel on Palestine action discusses neutrality in Ireland's stance, tying neutrality to politics and defence while noting government critique and activism. | Palestine, neutrality, Ireland, BDS, militarization | - Opinion - 10 Apr 26 Sally Rooney and Omar Barghouti speak at BDS Panel: ""The Irish government is not listening to its people, not just about Palestine but about everything"" Sally Rooney and Omar Barghouti were joined",https://www.hotpress.com/opinion/sally-rooney-and-omar-barghouti-speak-at-bds-panel-the-irish-government-is-not-listening-to-its-people-not-just-about-palestine-but-about-everything-23137398
Government,Actor / organisation,Colm McCarthy: defence spending may need a shot in the arm,The Irish Farmers Journal,Ukraine war and moral neutrality,Budget / Fiscal / Public Finances,Move away / stronger alignment,1.033,"d argues for maintaining neutrality while managing defence costs. | neutrality, defence, Ireland, NATO, EU | As the war in the Middle East heads into its seventh week, the cost of economic fallout for countries with no direct involvement is bound to rise. The Government has already used up some budgetary ammunition, with fuel subsidies to the tune of €250m for the period to the end of May, and may continue spending beyond that date. An international recession would hit Government tax revenue, already vulnerable through the over-reliance on corporation tax from US multinationals. The US tax authorities could, at any stage, get less generous to American companies booking profits abroad. On the expenditure side, there has been loose control in recent years including big overshoots on budget allocations, and there are upward long-term pressures arising from population ageing. It cannot be assumed that Ireland’s budget surplus will last forever and it",http://farmersjournal.ie/viewpoints/viewpoints/colm-mccarthy-defence-spending-may-need-a-shot-in-the-arm-910743
The Irish Independent,Media outlet,Letters: Putting US soldiers on the ground in Iran will only turn public against Donald Trump,The Irish Independent,Ukraine war and moral neutrality,Triple Lock / UN Mandate,Preserve / strengthen neutrality,1.033,"Letters: Putting US soldiers on the ground in Iran will only turn public against Donald Trump | Reports that the US is preparing for a ground invasion in Iran is hopefully nothing more than intimidatory optics in the game of negotiations. | A letter discusses neutrality and calls for a referendum amid defence and EU militarisation debates, tying the term neutrality to broader policy discussions. | neutrality, defence, politics, referendum, UN Security Council | Letters: Putting US soldiers on the ground in Iran will only turn public against Donald Trump Reports that the US is preparing for a ground invasion in Iran is hopefully nothing more than intimidatory optics in the game of negotiation",https://independent.ie/opinion/letters/letters-putting-us-soldiers-on-the-ground-in-iran-will-only-turn-public-against-donald-trump/a486049948.html
The Irish Independent,Media outlet,Letters: Targeted relief on fuel tax is possible and could help prevent economic threats,The Irish Independent,Defence capability and security gaps,Budget / Fiscal / Public Finances,Mixed / procedural / unclear,1.033,"Letters: Targeted relief on fuel tax is possible and could help prevent economic threats | I fully concur with Michael Gannon’s assessment that the Irish public have faced pronounced price increases from the petroleum sector over the past week (‘Fuel retailers are quicker to raise their prices than they are to pass on savings’, Letters, March 9). | A letter urging Ireland to reaffirm its tradition of positive neutrality in international affairs, aligning with the term neutrality. | neutrality, international law, Ireland, defence, politics | Letters: Targeted relief on fuel tax is possible and could help prevent economic threats I fully concur with Michael Gannon’s assessment that the Irish p",https://independent.ie/opinion/letters/letters-targeted-relief-on-fuel-tax-is-possible-and-could-help-prevent-economic-threats/a1363336737.html
The Irish Independent,Media outlet,Letters: Ireland should offer a safe space for warring parties to sit down and talk peace,The Irish Independent,Ukraine war and moral neutrality,Ukraine / Russia / Moral Responsibility,Preserve / strengthen neutrality,1.033,"Letters: Ireland should offer a safe space for warring parties to sit down and talk peace | There are currently at least 20 major conflicts taking place in the world, resulting in the loss of hundreds of thousands of human lives, without even considering the widespread destruction of property. | A letter arguing for Ireland to uphold neutrality and to host peace talks as a neutral venue, tying the concept of neutrality to Ireland's foreign policy and constitutional principles. | neutrality, peace talks, Ireland, foreign policy, Bunreacht na hÉireann | Letters: Ireland should offer a safe space for warring parties to sit down and talk peace There are currently at least 20 major conflicts taki",https://independent.ie/opinion/letters/letters-ireland-should-offer-a-safe-space-for-warring-parties-to-sit-down-and-talk-peace/a1569192180.html
The Irish Independent,Media outlet,"We really need adequate defence, neutrality is just ridiculous in these times",The Irish Independent,Ukraine war and moral neutrality,Other Neutrality Debate,Mixed / procedural / unclear,0.997,"We really need adequate defence, neutrality is just ridiculous in these times | | Larry Dunne argues that neutrality is nonsense and Ireland should maintain adequate defence in the face of security challenges. | neutrality, defence, defence forces, military policy, public safety | Clearly, the neutrality of this country is important to many. Its praises are sung and our Defence Forces are actually seen as primarily peacekeepers abroad rather than being a bastion against external attack. Even essential military aid to states under invasion has to be non-lethal and non-combative. And of course we have the Triple Lock mechanism to comply with before we can send troops under the proud cover of t",
The Irish Independent,Media outlet,Government now needs to rediscover Irish tradition of positive neutrality,The Irish Independent,Ukraine war and moral neutrality,Other Neutrality Debate,Mixed / procedural / unclear,0.997,"Government now needs to rediscover Irish tradition of positive neutrality | | A Letter urging Ireland to rediscover its tradition of positive neutrality and respect for international law amid Middle East tensions. | neutrality, international law, Ireland, military neutrality, foreign policy | Thank God and the Irish electorate for President Catherine Connolly. She correctly stated that what we are witnessing in the Middle East and beyond are ""deliberate assaults on international law"". She added: ""We must name them as such without euphemism and without equivocation."" It's a pity our political leaders haven't spoken out. The President clearly represents the views of the Irish people of all pol",
The Irish Examiner,Media outlet,Letters to the Editor: Neutralising Ireland’s neutrality,The Irish Examiner,Ukraine war and moral neutrality,Shannon / US Military / Anti-war,Preserve / strengthen neutrality,1.074,"Letters to the Editor: Neutralising Ireland’s neutrality | Letters to the Editor: Neutralising Ireland’s neutrality: A comprehensive series of articles on this topic | A Letters to the Editor arguing for maintaining Ireland’s neutrality and opposing proposals to replace UN approval with EU/regional consent, highlighting the relevance of 'neutrality' to policy. | neutrality, defence, NATO, UN, Shannon | Revolutionary leader Daniel O’Connell (1775-1847) said that, ‘Nothing is politically correct that is morally wrong.’ It is therefore difficult to rationalise Taoiseach Micheál Martin’s decision to remove the necessity of a United Nations mandate for the deployment of Irish troops abroad. The m",https://irishexaminer.com/opinion/yourview/arid-41838741.html
The Irish Examiner,Media outlet,Seán Kelly: Viktor Orbán's loss is the EU's opportunity for a bold move on foreign policy,The Irish Examiner,Ukraine war and moral neutrality,Triple Lock / UN Mandate,Preserve / strengthen neutrality,1.032,"Seán Kelly: Viktor Orbán's loss is the EU's opportunity for a bold move on foreign policy | We need a strong EU, capable of acting swiftly, decisively and in the interests of the vast majority of its member states, writes Seán Kelly, MEP for Ireland South | Seán Kelly argues for an EU reform that would reduce veto power while preserving Ireland's neutrality, framing neutrality as central to Ireland's defence and foreign policy. | neutrality, Ireland, EU, veto, defence | Seán Kelly: Viktor Orbán's loss is the EU's opportunity for a bold move on foreign policy Viktor Orbán’s spectacular defeat in Sunday’s Hungarian election has been music to the ears of those of us who have been frustrated by ",https://irishexaminer.com/opinion/commentanalysis/arid-41831303.html
The Irish Examiner,Media outlet,Ireland is addicted to contracting away all kinds of State capacity,The Irish Examiner,Ukraine war and moral neutrality,Other Neutrality Debate,Mixed / procedural / unclear,1.032,"Ireland is addicted to contracting away all kinds of State capacity | By treating governance as contract administration, we are letting our sovereignty erode gradually through every decision we outsource, writes Paul Davis | An opinion column argues that Ireland's outsourcing of core state functions undermines neutrality and sovereignty, urging retention of domestic capacity and stronger governance. | neutrality, sovereignty, defence outsourcing, governance, accountability | Ireland is addicted to contracting away all kinds of State capacity Tony Geraghty’s warning earlier this year in the Irish Examiner about the strategic costs of outsourcing Ireland’s defence deserves serious attention. A",https://irishexaminer.com/opinion/commentanalysis/arid-41830613.html
The Irish Examiner,Media outlet,Letters to the Editor: Waste disposal should never have been privatised,The Irish Examiner,Triple Lock and UN mandate debate,Other Neutrality Debate,Preserve / strengthen neutrality,1.032,"Letters to the Editor: Waste disposal should never have been privatised | A reader says illegal dumping crisis would never have arisen but for the decision many years ago to abdicate a statutory function — the collection and disposal of domestic and commercial waste | The letter defends Ireland's neutrality and argues against changes to the triple lock and deployment rules, tying the debate to broader defence and political policy discussions. | neutrality, Ireland, defence, NATO, Triple Lock | Letters to the Editor: Waste disposal should never have been privatised I read with interest the column dedicated to the escalating scourge of illegal dumping experienced by Cork County Council through",https://irishexaminer.com/opinion/yourview/arid-41828534.html
The Irish Examiner,Media outlet,Letters to the Editor: MEP says Ireland must stop outsourcing sovereign decisions,The Irish Examiner,Ukraine war and moral neutrality,Other Neutrality Debate,Mixed / procedural / unclear,1.032,"Letters to the Editor: MEP says Ireland must stop outsourcing sovereign decisions | Barry Andrews MEP writes: 'Taking back control of overseas deployment is... an assertion of our neutrality and our sovereignty' | A letter arguing in favor of neutrality as a key aspect of Ireland's defence and sovereignty, linking the term neutrality to policy decisions and international diplomacy. | neutrality, sovereignty, defence, Ireland, diplomacy | Letters to the Editor: MEP says Ireland must stop outsourcing sovereign decisions More than 400 academics argued last week against reform of the Irish triple lock policy, but it seems their only argument against it was that we may end up in conflict with a n",https://irishexaminer.com/opinion/yourview/arid-41826299.html
Dáil,Actor / organisation,Letters to the Editor: Neutralising Ireland’s neutrality,The Irish Examiner,Ukraine war and moral neutrality,Shannon / US Military / Anti-war,Preserve / strengthen neutrality,1.074," wrong.’ It is therefore difficult to rationalise Taoiseach Micheál Martin’s decision to remove the necessity of a United Nations mandate for the deployment of Irish troops abroad. The mandate is the core of the triple lock, which requires UN, government, and Dáil approval before troops can be sent overseas. The Irish people voted to reject both the Nice (in 2001) and Lisbon treaties (in the first referendum in 2008) because of fears of a militarised EU, but were reassured after Fianna Fáil introduced the lock. Now, there is the possibility that Irish troops could be deployed at the behest of the EU, and the EU is inextricably linked with Nato. To remove the lock would negate Ireland’s credibility as a peacemaker. Ireland needs to work for reform of the UN and be a voice for peace. US president JF Kennedy stated in his speech to the Dáil in 1963 that: “It matters not how small a nation is that seeks world peace.” It does matter that the Taoiseach",https://irishexaminer.com/opinion/yourview/arid-41838741.html
Dáil,Actor / organisation,Sinéad O'Sullivan: Calling in the Defence Forces against fuel protesters is a huge strategic error,The Irish Times,Ukraine war and moral neutrality,Defence Capability / Underinvestment,Preserve / strengthen neutrality,1.033,"Sinéad O'Sullivan: Calling in the Defence Forces against fuel protesters is a huge strategic error | By sending in the army to move tractors, the Government has proved every sceptic of increased defence spending right | The article discusses neutrality in Ireland's defence policy amid protests and argues for stronger defence capability, illustrating how neutrality is being reconsidered in this context. | defence, neutrality, Ireland, military, protests | The French have been blocking streets to force the hand of the state since 1789. In 2018, they blocked roundabouts in yellow vests and the government reversed a fuel tax within weeks. In France, barricades are not a threat to the republic – ",https://irishtimes.com/opinion/2026/04/09/sinead-osullivan-calling-in-the-defence-forces-against-fuel-protesters-is-a-huge-strategic-error
Dáil,Actor / organisation,"Letters to the Editor, March 30th: On redress schemes in health service, consultants’ fees and let’s hear it for the buses",The Irish Times,Ukraine war and moral neutrality,Ukraine / Russia / Moral Responsibility,Reform / redefine neutrality,1.033,"ffective regime for managerial accountability, that is accountability with consequences arising. At the MacGill Summer School in 2018, the late Vicky Phelan said: “I don’t want apologies. I want accountability”. She never got it. Handwringing apologies in the Dáil and redress schemes represent an entirely inadequate response by the State. – Yours, etc, DR EDDIE MOLLOY, Former chair of Mental Health Reform, Dublin 6. Low-hanging fruit Sir, – The Irish Times editorial (March 26th) is probably correct, we could get by with fewer TDs and fewer office holders than the rising population would indicate. However, it’s hardly fair to compare the Oireachtas to the British Houses of Parliament without including the 850 “working” Lords from which some ministers are drawn, as well as 650 MPs. In addition, they have an extended Royal family which carries out many of the functions ministers do here, regional parliaments and assemblies, directly elected mayor",https://irishtimes.com/opinion/letters/2026/03/30/letters-to-the-editor-march-30th-on-redress-schemes-in-health-service-consultants-fees-and-lets-hear-it-for-the-buses
