entity,entity_group,headline,outlet,cluster_name,dominant_frame,stance_bucket,mention_weight,evidence_excerpt,link
Palestine,Actor / organisation,"Fuel demonstrations prove protests ‘effective’, say neutrality campaigners | BreakingNews",Breakingnews.ie,Defence capability and security gaps,Other Neutrality Debate,Preserve / strengthen neutrality,0.975,"y will “move”. “If we don’t put the pressure on them, they are going to sail along, and we will lose that protection we have,” he said. Representatives of the the Teachers Union of Ireland, Sinn Féin, Social Democrats, the Irish Neutrality League, the Ireland Palestine Solidarity Campaign, People Before Profit and independent senator Tom Clonan took part in the press conference. There was a strong focus on the importance of Ireland’s triple lock, the mechanism for sending Irish troops on peacekeeping missions. Under it, Ireland cannot deploy any more than 12 Defence Forces peacekeepers overseas without a peacekeeping mission being approved by a vote of the UN security council, by the Government and by the Dáil. Legislation, the Defence (Amendment) Bill 2025, put forward by the Government last year, proposes to remove the triple lock. Social Democrat TD Sinead Gibney said: “The removal of the triple lock, and this defence Act that the Government i",https://www.breakingnews.ie/ireland/fuel-demonstrations-prove-protests-effective-say-neutrality-campaigners-1887441.html
UN Security Council,Actor / organisation,Classic Hits 4FM - Neutrality,Classic Hits 4FM,Sinn Féin and government neutrality clash,Triple Lock / UN Mandate,Preserve / strengthen neutrality,1.045,"changed the demonstration took place during a dublin city council debate on whether the government should be stopped from scrapping the un mandate needed to deploy irish troops overseas the government argues this will prevent the five permanent members of the un security council russia, china, the us, the uk and france from using their veto on irish peacekeeping missions. niamh nivreen, member of the neutrality roadshow,",
UN Security Council,Actor / organisation,Irish Defence Forces must continue to hold the blue line in Lebanon,The Irish Times,Ukraine war and moral neutrality,Peacekeeping / Identity / Tradition,Preserve / strengthen neutrality,1.033,"Irish Defence Forces must continue to hold the blue line in Lebanon | In a wider geopolitical context of escalating conflict, and growing militarisation, someone must stand up for peace | The article argues that neutrality remains essential to Ireland's Unifil peacekeeping role and urges Ireland to uphold neutrality. | neutrality, peacekeeping, Unifil, Ireland, UN | With two Indonesian peacekeepers killed this week as Israel continues its military assault on Lebanon, the situation facing Irish peacekeepers serving with the United Nations peacekeeping mission, Unifil, is increasingly perilous. There has been what Taoiseach Micheál Martin described as a “shocking escalation of violence that ha",https://irishtimes.com/opinion/2026/04/02/irish-defence-forces-must-continue-to-hold-the-blue-line-in-lebanon
UN Security Council,Actor / organisation,Letters: Putting US soldiers on the ground in Iran will only turn public against Donald Trump,The Irish Independent,Ukraine war and moral neutrality,Triple Lock / UN Mandate,Preserve / strengthen neutrality,1.033," than intimidatory optics in the game of negotiations. | A letter discusses neutrality and calls for a referendum amid defence and EU militarisation debates, tying the term neutrality to broader policy discussions. | neutrality, defence, politics, referendum, UN Security Council | Letters: Putting US soldiers on the ground in Iran will only turn public against Donald Trump Reports that the US is preparing for a ground invasion in Iran is hopefully nothing more than intimidatory optics in the game of negotiations. Otherwise, with boots on the ground, the war will have a different feel and meaning for MAGA supporters and the wider US public. The sight of US Marines coming home in coffins will place Donald Trump in the dock as an out-of-control mad commander-in-chief. Whoever is building that off-ramp that Trump seeks will need to get a move on smartly, for all our sakes. Aidan Roddy, Cabinteely, Dublin 18 With 400 diagnoses a year, attention must b",https://independent.ie/opinion/letters/letters-putting-us-soldiers-on-the-ground-in-iran-will-only-turn-public-against-donald-trump/a486049948.html
UN Security Council,Actor / organisation,Seán Kelly: Viktor Orbán's loss is the EU's opportunity for a bold move on foreign policy,The Irish Examiner,Ukraine war and moral neutrality,Triple Lock / UN Mandate,Preserve / strengthen neutrality,1.032,"Seán Kelly: Viktor Orbán's loss is the EU's opportunity for a bold move on foreign policy | We need a strong EU, capable of acting swiftly, decisively and in the interests of the vast majority of its member states, writes Seán Kelly, MEP for Ireland South | Seán Kelly argues for an EU reform that would reduce veto power while preserving Ireland's neutrality, framing neutrality as central to Ireland's defence and foreign policy. | neutrality, Ireland, EU, veto, defence | Seán Kelly: Viktor Orbán's loss is the EU's opportunity for a bold move on foreign policy Viktor Orbán’s spectacular defeat in Sunday’s Hungarian election has been music to the ears of those of us who have been frustrated by ",https://irishexaminer.com/opinion/commentanalysis/arid-41831303.html
UN Security Council,Actor / organisation,Letters to the Editor: MEP says Ireland must stop outsourcing sovereign decisions,The Irish Examiner,Ukraine war and moral neutrality,Other Neutrality Debate,Mixed / procedural / unclear,1.032," years are Turkey, Oman, Qatar, and Pakistan. If any European country has played a such role in recent decades, it is the Nato member, Norway. I support neutrality, but let us stop outsourcing our sovereign decisions to an increasingly authoritarian dominated UN Security Council. I don’t dispute that the fuel protesters have legitimate grievances at play here, but you cannot hold a country to ransom. We hear about petrol running out around the country. Businesses in Dublin city centre are being decimated. Many people are unable to get to work or make hospital appointments. This has to end. We can’t have the country paralysed by these blockades. The vast preponderance of citizens agree on public protests, but you cannot paralyse the country. If I parked my car in the middle of O’Connell St, I would not get away with it. So it’s now a question of why are we allowing this to happen? It’s hard to avoid coverage on the fuel protests, not just by media",https://irishexaminer.com/opinion/yourview/arid-41826299.html
Fine Gael,Actor / organisation,Letters to the Editor: Irish political parties must condemn call for EU army,The Irish Examiner,Ukraine war and moral neutrality,Ukraine / Russia / Moral Responsibility,Preserve / strengthen neutrality,1.032,"Letters to the Editor: Irish political parties must condemn call for EU army | 'Are Fianna Fáil and Fine Gael ready to sign up Ireland to a 'coalition of the willing' in support of Denmark and Greenland?' | A letters-to-the-editor piece arguing for Ireland's neutrality and cautioning against an EU standing army, directly tied to the search_term neutrality. | neutrality, Ireland, EU army, defence policy, militarism | Letters to the Editor: Irish political parties must condemn call for EU army European Union defence and space commissioner Andrius Kubilius has warned that the EU is obliged to come to Denmark’s assistance if it is faced with military aggression. Mr Kubilius remarked that “definitely there is such an obligation [on] member states to come for mutual assistance if another member ",https://irishexaminer.com/opinion/yourview/arid-41777927.html
Fine Gael,Actor / organisation,Irish presence at second World War event not in conflict with neutrality - officials,The Irish Times,General neutrality debate #2,Ukraine / Russia / Moral Responsibility,Mixed / procedural / unclear,0.977," Mary Robinson’s presence at commemorations in Paris in 1995 to mark the defeat of Nazi Germany would not conflict with Ireland’s neutrality, a senior Department of Foreign Affairs official advised. French president Francois Mitterand had invited Robinson and Fine Gael taoiseach John Bruton to so-called VE Day commemorations, along with the leaders of other states neutral in the second World War, including Sweden and Switzerland and Austria. “The issue of attendance at such commemoration ceremonies, remembrance days, etc, has always been a sensitive one,” noted the head of Foreign Affairs’ political division, Richard Townsend. “Ireland’s neutrality in World War II and sensitivities in the Anglo-Irish context have led governments in the past to decline such invitations,” he said, though feelings on the issue “have abated somewhat in recent years”. READ MORE State Papers: What we learned, from Ahern’s lobbying of Blair over Sellafield to ‘distress’",https://irishtimes.com/history/2025/12/29/irish-presence-at-second-world-war-event-not-in-conflict-with-neutrality-officials
Fine Gael,Actor / organisation,Today FM - Neutrality,Today FM,Sinn Féin and government neutrality clash,Other Neutrality Debate,Preserve / strengthen neutrality,0.959,"| neutrality, irish neutrality, politics, Mary Lou McDonald, Sinn Fein | mary lou macdonald says the government parties are trying to dismantle irish neutrality by stealth. addressing a rally in dublin yesterday, the sinn fein leader said that fianna fail and fine gael want to scrap the triple lock without consent and without a mandate.",
Fine Gael,Actor / organisation,Today FM - Neutrality,Today FM,Sinn Féin and government neutrality clash,Other Neutrality Debate,Preserve / strengthen neutrality,0.959,"overage. | neutrality, Irish neutrality, government, Sinn Fein, stealth | mary lou macdonald says the government's trying to dismantle irish neutrality by stealth. addressing a rally in dublin yesterday, deputy macdonald renewed her message to fianna fail and fine gael that if they want to scrap the triple lock, they need to put it to the people.",
Fine Gael,Actor / organisation,Today FM - Neutrality,Today FM,Sinn Féin and government neutrality clash,Other Neutrality Debate,Preserve / strengthen neutrality,0.959,"ies are trying to dismantle irish neutrality by stealth. | The transcript centers on neutrality in Ireland, with Mary Lou MacDonald accusing government parties of dismantling Irish neutrality by stealth. | neutrality, Ireland, Mary Lou MacDonald, Fianna Fáil, Fine Gael | mary lou macdonald says the government parties are trying to dismantle irish neutrality by stealth. addressing a rally in dublin yesterday, the sinn fein leader said that fianna fail and fine gael want to scrap the triple lock without consent and without a mandate. deputy macdonald says the country can't in now itself be dragged into somebody else's war. irish neutrality is under threat from fianna fail and fine gael. they're very clear that they want to dismantle our proud tradition and expose ireland and especially irish young people to the prospect of wars not of our making that have nothing to do with us. four people had a narrow escape after they were rescued from a burning ",
Mary Lou McDonald,Actor / organisation,Shinners shine at backing bad guys,Sunday Independent (Ireland),Ukraine war and moral neutrality,Ukraine / Russia / Moral Responsibility,Mixed / procedural / unclear,0.992,"Shinners shine at backing bad guys | | The column questions Irish neutrality in the Ukraine war and examines whether the stance affects Ireland's position. | neutrality, Ukraine, Ireland, defence, politics | Sunday Independent 22 February 2024 Opinion # Shinners shine at backing bad guys ## Declan Lynch ![img-0.jpeg](img-0.jpeg) Now we pride ourselves in getting the big calls right in this column, we keep a keen eye on these getting the big calls wrong. A few weeks ago, we were now reaching to Pearce Doherty's statement on the 19th, declaring Alan Fitch's opposition to an KU banding plan for Ukraine. Was it even possible for them to be getting this big call so wrong? Now that Stan Fritch MEN",
Mary Lou McDonald,Actor / organisation,"Irish neutrality should be put to a public vote, say Sinn Féin | BreakingNews",Breakingnews.ie,Referendum and constitutional protection,Other Neutrality Debate,Preserve / strengthen neutrality,0.975,"Irish neutrality should be put to a public vote, say Sinn Féin | BreakingNews | Mary Lou McDonald said Sinn Fein want to see a ‘positive assertion’ on Irish neutrality in the constitution. | The piece discusses Sinn Féin's calls to enshrine Irish neutrality in the constitution and to hold a referendum, tying the search_term neutrality to Irish defence and political policy. | neutrality, referendum, constitution, Ireland, defence | The Government should put Irish neutrality to a public vote, Sinn Féin have said. The party launched their policy, Protecting Ireland’s Neutrality, in Dublin on Thursday. Speaking to reporters at the event, Sinn Féin leader Mary Lou McDonald said if the Government wanted to “dismantle” the Triple Lock on neutrality they are “honour bound” to “",https://www.breakingnews.ie/ireland/irish-neutrality-should-be-put-to-a-public-vote-say-sinn-fein-1884588.html
Mary Lou McDonald,Actor / organisation,"Irish neutrality should be put to a public vote, say Sinn Fein",The Belfast Telegraph,Referendum and constitutional protection,Other Neutrality Debate,Preserve / strengthen neutrality,0.961,"m, Ireland, Sinn Fein, Triple Lock | The Government should put Irish neutrality to a public vote, Sinn Fein have said. The party launched their policy, Protecting Ireland’s Neutrality, in Dublin on Thursday. Speaking to reporters at the event Sinn Fein leader Mary Lou McDonald said if the Government wanted to “dismantle” the Triple Lock on neutrality they are “honour bound” to “go to the people and seek the democratic mandate”. The Triple Lock is the mechanism for sending Irish troops on peacekeeping missions. Under it, Ireland cannot deploy any more than 12 Defence Forces peacekeepers overseas without a peacekeeping mission being approved by a vote of the UN Security Council, by the government and by the Dail. Ms McDonald also said the party want a referendum to be put to Irish voters to “include a positive assertion of Irish neutrality within the Irish constitution”. In addition, she said Sinn Fein want the position of neutral countries, like I",https://www.belfasttelegraph.co.uk/news/republic-of-ireland/irish-neutrality-should-be-put-to-a-public-vote-say-sinn-fein/a/145506254.html
Mary Lou McDonald,Actor / organisation,Today FM - Neutrality,Today FM,Sinn Féin and government neutrality clash,Other Neutrality Debate,Preserve / strengthen neutrality,0.959,"says the government parties are trying to dismantle irish neutrality by stealth. | The discussion centers on neutrality in Ireland, noting a claim that government parties are trying to dismantle neutrality by stealth. | neutrality, irish neutrality, politics, Mary Lou McDonald, Sinn Fein | mary lou macdonald says the government parties are trying to dismantle irish neutrality by stealth. addressing a rally in dublin yesterday, the sinn fein leader said that fianna fail and fine gael want to scrap the triple lock without consent and without a mandate.",
Mary Lou McDonald,Actor / organisation,Today FM - Neutrality,Today FM,Sinn Féin and government neutrality clash,Other Neutrality Debate,Preserve / strengthen neutrality,0.959,"Today FM - Neutrality | mary lou macdonald says the government's trying to dismantle irish neutrality by stealth. | Mary Lou McDonald's assertion that Irish neutrality is being dismantled by stealth frames neutrality as a central political issue in this coverage. | neutrality, Irish neutrality, government, Sinn Fein, stealth | mary lou macdonald says the government's trying to dismantle irish neutrality by stealth. addressing a rally in dublin yesterday, deputy macdonald renewed her message to fianna fail and fine gael that if they want to scrap the triple lock, they need to put it to the people.",
Gaza,Actor / organisation,The war dogs couldn’t give a damn about climate change – so where does that leave us? | Hotpress,Hot Press,Ukraine war and moral neutrality,Ukraine / Russia / Moral Responsibility,Preserve / strengthen neutrality,1.033,"our mansion / While the young people’s blood / Flows out of their bodies / And is buried in the mud.” Same as it ever was. Look at the rich pickings they make, these self-admiring gods of hellfire and brimstone, these masters of war and all their enablers. In Gaza. In Ukraine. In Somalia. In Sudan. In the Democratic Republic of Congo. And now in Iran, Lebanon, Syria, and across the Middle East. We know that wars lead to death, trauma, wreckage and ruins. That much has happened already in the attack by Israel and the US on Iran. At some point there will be talk of reparations, reconstruction and, probably, retribution. Resources will be needed for post-war reconstruction. Already, the exploiters, gougers and billionaire chancers are salivating at the trillions to be made. Destroy it so that you can be paid billions to rebuild it. This madness is written about elsewhere in the current issue of Hot Press. Meanwhile, an even greater danger is lurking",https://www.hotpress.com/opinion/the-war-dogs-couldnt-give-a-damn-about-climate-change-so-where-does-that-leave-us-23135471
Gaza,Actor / organisation,EU’s values not as clear as they should be,The Irish Times,Ukraine war and moral neutrality,Other Neutrality Debate,Preserve / strengthen neutrality,1.033,"EU’s values not as clear as they should be | Different attitudes to Ukraine and Gaza a problem | A letter discussing Ireland's neutrality in defence/politics and arguing for a referendum, tying neutrality to democratic values. | neutrality, referendum, defence, EU, Gaza | Sir, - When Bobby McDonagh and Brigid Laffan declare “the world needs the European Union’s values”, exactly what values are they referring to (“Ireland needs to grow up and get serious about its interests,” Opinion, March 18th)? The EU has failed to apply any sanctions against Israel during the two-plus years of genocide inflicted on the people of Gaza, which is in stark contrast to its stance on Ukraine. Worse still, a number of its member states continue to actively sell weapons to Israel to enable c",https://irishtimes.com/opinion/letters/2026/03/19/eus-values-not-as-clear-as-they-should-be
Gaza,Actor / organisation,Jennie C Stephens: Ireland can offer hope as militarisation hastens climate catastrophe,The Irish Times,Ukraine war and moral neutrality,Ukraine / Russia / Moral Responsibility,Preserve / strengthen neutrality,1.033,"ed for the AI tools now used extensively in military operations to track, detain and kill people. READ MORE The US military used AI to capture Venezuela’s president and to strike Iran; Israel has relied on sophisticated AI surveillance systems for genocide in Gaza. Ireland is an important hub in the global data centre network; it is unclear to what extent our data centres are powering militarised AI. Militarisation is also catastrophic for climate because it increases corporate power and profits among companies and industries that invest heavily in climate obstructionism, sabotaging climate action around the world. Denying climate science and lobbying to delay climate policies has become common practice across many sectors and governments – including here in Ireland. Corporate power means the needs of large multinational corporations are prioritised over community needs, including investments to reduce climate vulnerabilities. It is not just weap",https://irishtimes.com/environment/climate-crisis/2026/03/19/ireland-can-offer-hope-as-militarisation-hastens-climate-catastrophe
Gaza,Actor / organisation,Our leaders must show courage in commitment to peace by keeping the triple lock,The Irish Examiner,Triple Lock and UN mandate debate,Peacekeeping / Identity / Tradition,Lean preserve neutrality,1.032,"o on Cuba, whilst Israel has expanded its assault on southern Lebanon where it has attacked UN peacekeepers. During this same period we have also seen the president of the United States establish the so-called ‘Board of Peace’ to oversee the reconstruction of Gaza outside the structures of multilateral diplomacy and without the involvement of Palestinian representatives, whilst withdrawing funding from 66 international organizations, including 31 UN entities, and the International Fund for Ireland, which has been central to the peace process on this island for 40 years. What is most concerning from an Irish perspective, is the lack of clarity from minister Helen McEntee, who has refused to categorically state that the US and Israeli attacks on Iran are illegal under international law. This despite an early statement by the UN Secretary General clarifying that the US-Israeli attack was in contravention of the UN Charter which prohibits “the threat",https://irishexaminer.com/opinion/commentanalysis/arid-41823281.html
Gaza,Actor / organisation,Seán Kelly: Viktor Orbán's loss is the EU's opportunity for a bold move on foreign policy,The Irish Examiner,Ukraine war and moral neutrality,Triple Lock / UN Mandate,Preserve / strengthen neutrality,1.032,"Seán Kelly: Viktor Orbán's loss is the EU's opportunity for a bold move on foreign policy | We need a strong EU, capable of acting swiftly, decisively and in the interests of the vast majority of its member states, writes Seán Kelly, MEP for Ireland South | Seán Kelly argues for an EU reform that would reduce veto power while preserving Ireland's neutrality, framing neutrality as central to Ireland's defence and foreign policy. | neutrality, Ireland, EU, veto, defence | Seán Kelly: Viktor Orbán's loss is the EU's opportunity for a bold move on foreign policy Viktor Orbán’s spectacular defeat in Sunday’s Hungarian election has been music to the ears of those of us who have been frustrated by ",https://irishexaminer.com/opinion/commentanalysis/arid-41831303.html
The Pat Kenny Show,Media outlet,The Pat Kenny Show - Neutrality,The Pat Kenny Show,Ukraine war and moral neutrality,Other Neutrality Debate,Mixed / procedural / unclear,0.801,"The Pat Kenny Show - Neutrality | our neutrality is a strength and we are not using that huge opportunity to do the right thing in this situation. | The segment argues that Ireland's neutrality is a strength and should guide its stance on international law. | neutrality, international law, ireland, diplomacy, defence | e east and those were the words of the taoiseach. when we're a neutral country, when we have that strong voice, when we could have used that voice to stand up for international law, which absolutely needs to be done. and also, pat, it's incumbent on the taoiseach to represent the views of the irish people. and there's very strongly a view held by the irish people. our neutrali",
The Pat Kenny Show,Media outlet,The Pat Kenny Show - Neutrality,The Pat Kenny Show,Ukraine war and moral neutrality,Other Neutrality Debate,Preserve / strengthen neutrality,0.801,"The Pat Kenny Show - Neutrality | an anti-war protest about trying to defend irish neutrality because for us, part of this is also linked to the militarization of europe and | The segment discusses neutrality and highlights an anti-war protest aimed at defending Irish neutrality amid concerns about militarization in Europe. | neutrality, defence, anti-war, Ireland, militarization | lace. and i should say there will be an anti-war protest about trying to defend irish neutrality because for us, part of this is also linked to the militarization of europe and what we would see as, you know, the triple ox stuff dismantling our neutrality. to the protest this wednesday outside the dole to defend i",
The Pat Kenny Show,Media outlet,The Pat Kenny Show - Neutrality,The Pat Kenny Show,Ukraine war and moral neutrality,Other Neutrality Debate,Mixed / procedural / unclear,0.801,"The Pat Kenny Show - Neutrality | i think the whole neutrality conversation is a bigger conversation altogether. | Neutrality is framed as a broader, ongoing debate within Ireland's defence policy. | neutrality, defence, security, Ireland, debate | y. i think the whole neutrality conversation is a bigger conversation altogether. but you're not looking at that at the moment. you're looking at your protection of the island and protection of the citizen",
The Pat Kenny Show,Media outlet,The Pat Kenny Show - Neutrality,The Pat Kenny Show,Ukraine war and moral neutrality,Other Neutrality Debate,Mixed / procedural / unclear,0.801,"The Pat Kenny Show - Neutrality | girls of europe and get rid of this neutrality business and participate in this european programme as much as anybody else does. | A discussion about neutrality explores whether Ireland should maintain neutrality as its defence posture versus increased military spending. | neutrality, defence, militarisation, ireland, eu | n. our best defence is our neutrality. what do you say to all of that, carl? and that point that breed makes at the e",
